{
    "schema_version":  "1.0.0",
    "system":  "ASO-X Global Governance Lock System",
    "lock_count":  32,
    "locks":  [
                  {
                      "id":  "GOV-LOCK-001",
                      "title":  "Immutable Governance Source",
                      "status":  "locked",
                      "category":  "source-control",
                      "severity":  "blocking",
                      "owner":  "global-governance",
                      "rationale":  "Required for enterprise-grade global governance, durable artifact retention, and safe automated delivery.",
                      "enforcement":  [
                                          "tests/test_global_governance_locks.py",
                                          ".github/workflows/global-governance-locks.yml"
                                      ],
                      "artifacts":  [
                                        "governance/global-locks/registry.json",
                                        "governance/global-locks/registry.schema.json",
                                        "docs/governance/global-governance-locks.md"
                                    ]
                  },
                  {
                      "id":  "GOV-LOCK-002",
                      "title":  "BOM-Free UTF-8 LF Encoding",
                      "status":  "locked",
                      "category":  "encoding",
                      "severity":  "blocking",
                      "owner":  "global-governance",
                      "rationale":  "Required for enterprise-grade global governance, durable artifact retention, and safe automated delivery.",
                      "enforcement":  [
                                          "tests/test_global_governance_locks.py",
                                          ".github/workflows/global-governance-locks.yml"
                                      ],
                      "artifacts":  [
                                        "governance/global-locks/registry.json",
                                        "governance/global-locks/registry.schema.json",
                                        "docs/governance/global-governance-locks.md"
                                    ]
                  },
                  {
                      "id":  "GOV-LOCK-003",
                      "title":  "Atomic Artifact Writes",
                      "status":  "locked",
                      "category":  "artifact-retention",
                      "severity":  "blocking",
                      "owner":  "global-governance",
                      "rationale":  "Required for enterprise-grade global governance, durable artifact retention, and safe automated delivery.",
                      "enforcement":  [
                                          "tests/test_global_governance_locks.py",
                                          ".github/workflows/global-governance-locks.yml"
                                      ],
                      "artifacts":  [
                                        "governance/global-locks/registry.json",
                                        "governance/global-locks/registry.schema.json",
                                        "docs/governance/global-governance-locks.md"
                                    ]
                  },
                  {
                      "id":  "GOV-LOCK-004",
                      "title":  "Schema-First Governance Registry",
                      "status":  "locked",
                      "category":  "schema",
                      "severity":  "blocking",
                      "owner":  "global-governance",
                      "rationale":  "Required for enterprise-grade global governance, durable artifact retention, and safe automated delivery.",
                      "enforcement":  [
                                          "tests/test_global_governance_locks.py",
                                          ".github/workflows/global-governance-locks.yml"
                                      ],
                      "artifacts":  [
                                        "governance/global-locks/registry.json",
                                        "governance/global-locks/registry.schema.json",
                                        "docs/governance/global-governance-locks.md"
                                    ]
                  },
                  {
                      "id":  "GOV-LOCK-005",
                      "title":  "Roadmap Governance Compatibility",
                      "status":  "locked",
                      "category":  "roadmap",
                      "severity":  "blocking",
                      "owner":  "global-governance",
                      "rationale":  "Required for enterprise-grade global governance, durable artifact retention, and safe automated delivery.",
                      "enforcement":  [
                                          "tests/test_global_governance_locks.py",
                                          ".github/workflows/global-governance-locks.yml"
                                      ],
                      "artifacts":  [
                                        "governance/global-locks/registry.json",
                                        "governance/global-locks/registry.schema.json",
                                        "docs/governance/global-governance-locks.md"
                                    ]
                  },
                  {
                      "id":  "GOV-LOCK-006",
                      "title":  "Safe Concurrent Edit Protection",
                      "status":  "locked",
                      "category":  "concurrency",
                      "severity":  "blocking",
                      "owner":  "global-governance",
                      "rationale":  "Required for enterprise-grade global governance, durable artifact retention, and safe automated delivery.",
                      "enforcement":  [
                                          "tests/test_global_governance_locks.py",
                                          ".github/workflows/global-governance-locks.yml"
                                      ],
                      "artifacts":  [
                                        "governance/global-locks/registry.json",
                                        "governance/global-locks/registry.schema.json",
                                        "docs/governance/global-governance-locks.md"
                                    ]
                  },
                  {
                      "id":  "GOV-LOCK-007",
                      "title":  "Pull Request Enforcement",
                      "status":  "locked",
                      "category":  "github",
                      "severity":  "blocking",
                      "owner":  "global-governance",
                      "rationale":  "Required for enterprise-grade global governance, durable artifact retention, and safe automated delivery.",
                      "enforcement":  [
                                          "tests/test_global_governance_locks.py",
                                          ".github/workflows/global-governance-locks.yml"
                                      ],
                      "artifacts":  [
                                        "governance/global-locks/registry.json",
                                        "governance/global-locks/registry.schema.json",
                                        "docs/governance/global-governance-locks.md"
                                    ]
                  },
                  {
                      "id":  "GOV-LOCK-008",
                      "title":  "No Direct Main Mutation",
                      "status":  "locked",
                      "category":  "github",
                      "severity":  "blocking",
                      "owner":  "global-governance",
                      "rationale":  "Required for enterprise-grade global governance, durable artifact retention, and safe automated delivery.",
                      "enforcement":  [
                                          "tests/test_global_governance_locks.py",
                                          ".github/workflows/global-governance-locks.yml"
                                      ],
                      "artifacts":  [
                                        "governance/global-locks/registry.json",
                                        "governance/global-locks/registry.schema.json",
                                        "docs/governance/global-governance-locks.md"
                                    ]
                  },
                  {
                      "id":  "GOV-LOCK-009",
                      "title":  "Artifact Retention Minimums",
                      "status":  "locked",
                      "category":  "artifact-retention",
                      "severity":  "blocking",
                      "owner":  "global-governance",
                      "rationale":  "Required for enterprise-grade global governance, durable artifact retention, and safe automated delivery.",
                      "enforcement":  [
                                          "tests/test_global_governance_locks.py",
                                          ".github/workflows/global-governance-locks.yml"
                                      ],
                      "artifacts":  [
                                        "governance/global-locks/registry.json",
                                        "governance/global-locks/registry.schema.json",
                                        "docs/governance/global-governance-locks.md"
                                    ]
                  },
                  {
                      "id":  "GOV-LOCK-010",
                      "title":  "Real Money Resilience Guard",
                      "status":  "locked",
                      "category":  "financial-resilience",